{
  "meta": {
    "schema": "scene.v1",
    "version": "1.0",
    "created": "2025-09-24T19:30:00.000Z",
    "modified": "2025-09-24T19:30:00.000Z",
    "author": "test-user",
    "name": "Test Scene Layout"
  },
  "grid": {
    "width": 15,
    "height": 10,
    "cellSize": 20
  },
  "tiles": {
    "floor": [
      [2, 2], [3, 2], [4, 2], [5, 2],
      [2, 3], [3, 3], [4, 3], [5, 3],
      [2, 4], [3, 4], [4, 4], [5, 4],
      [8, 6], [9, 6], [10, 6],
      [8, 7], [9, 7], [10, 7]
    ]
  },
  "edges": {
    "horizontal": [
      [2, 2], [3, 2], [4, 2], [5, 2],
      [2, 5], [3, 5], [4, 5], [5, 5]
    ],
    "vertical": [
      [2, 2], [2, 3], [2, 4],
      [6, 2], [6, 3], [6, 4]
    ]
  }
}