{
  "meta": {
    "schema": "scene.v1",
    "version": "1.0",
    "created": "2025-09-25T10:48:40.777Z",
    "modified": "2025-09-25T10:48:40.777Z"
  },
  "grid": {
    "width": 60,
    "height": 40,
    "cellSize": 20
  },
  "tiles": {
    "floor": []
  },
  "edges": {
    "horizontal": [
      [
        18,
        6
      ],
      [
        18,
        7
      ]
    ],
    "vertical": [
      [
        18,
        4
      ],
      [
        18,
        5
      ],
      [
        18,
        7
      ]
    ]
  }
}